{
  "test_only": true,
  "notice": "TEST-ONLY：虚构个人模板画像，仅用于离线目录解析测试。",
  "schema_version": "1.0.0",
  "engine_version": "1.2.0",
  "profile_kind": "writing",
  "profile_id": "PROFILE-TPL-P-S-001",
  "template_id": "TPL-P-S-001",
  "name": "TEST-ONLY标准买卖合同起诉状",
  "document_type": "civil_complaint",
  "usage_mode": "reference",
  "status": "active",
  "activated_at": "2026-08-25T13:45:00Z",
  "approval": {
    "confirmed": true,
    "approved_by": "TEST-ONLY-fixture-lawyer",
    "decision_id": "TEST-ONLY-PROFILE-APPROVAL-001"
  },
  "distilled_at": "2026-08-25T13:42:26Z",
  "source": {
    "path": "../templates/TEST-ONLY-simple-reference.docx",
    "sha256": "cb946dda8f0c862d61a0b178a0c73dd146ce92afcbd59d87fd8ebc626bbeafbd",
    "suffix": ".docx",
    "read_only_verified": true,
    "package_inventory_sha256": "e8d0e08add4ac6a78591a11c5554fbac6cc52250c466cb57ac6c38086d21c2ad"
  },
  "layout": {
    "paragraph_count": 16,
    "table_count": 0,
    "section_count": 1,
    "text_node_count": 8,
    "unanchored_empty_table_cells": []
  },
  "package_contract": {
    "parts": {
      "[Content_Types].xml": {
        "size": 814,
        "sha256": "356b392ebcbfc20d1d97a70bb6cd9beea7805bc1f9353f0703d653dbb425c840",
        "structure_sha256": "307c4836c0f2fd7a40f6cda8ec63361deaddf8cd84fdd5da262a08b79ae6fb10",
        "compression": 8
      },
      "_rels/.rels": {
        "size": 599,
        "sha256": "43bdd04f31bc9c60ecca6b3faf6a72376fc8060387613530dac16f33a95ad125",
        "structure_sha256": "e675952665f31f4ae95b80082fbb8db101de8e78146697b419169f8df67ec306",
        "compression": 8
      },
      "word/document.xml": {
        "size": 2093,
        "sha256": "ac7e036eb6695bf8f229f9270b8445e6cff37b9a602b5b6f677f0fdbe97a14ab",
        "structure_sha256": "98cae3ee147ae0ee340295f0c6c31d141c6565c7621db7d27efb2f587d84a48d",
        "compression": 8
      },
      "word/styles.xml": {
        "size": 1048,
        "sha256": "b1d6dfcaedf779ccf0c5ff49e5dedcfc7180b5fc5d10091acd3e2b3947baac42",
        "structure_sha256": "e50e22e286ba9316d513d892a43c944865ec0389177d164be4590515091c8152",
        "compression": 8
      },
      "word/_rels/document.xml.rels": {
        "size": 287,
        "sha256": "c4424d40b3965466e429ebc82690c78d98dc094bb3163b45d731182baa3fac73",
        "structure_sha256": "2345b4bb780ac308917d2e11bcd408e8ad068a407d931e162420b6b65e6fe764",
        "compression": 8
      },
      "docProps/core.xml": {
        "size": 664,
        "sha256": "4f4b3f45129440e5c20d3d82cd17e6a6891eff61c520272e4bc8634e018309b1",
        "structure_sha256": "cd6c19bb34cd6eb6b957909779a733b0057f0dbc1baa6bad34c7723abdffda97",
        "compression": 8
      },
      "docProps/app.xml": {
        "size": 238,
        "sha256": "3683fe555967b42a873a8fc8693e0396bce7e42442a0a47c3e85d1cce1585fb1",
        "structure_sha256": "bfa2be1d020168a23e6668744829dd587003b3589cee44e7ffcc103d4f022677",
        "compression": 8
      }
    },
    "editable_parts": [],
    "preserve_only_parts": [
      "[Content_Types].xml",
      "_rels/.rels",
      "docProps/app.xml",
      "docProps/core.xml",
      "word/_rels/document.xml.rels",
      "word/document.xml",
      "word/styles.xml"
    ]
  },
  "visual_baseline": {
    "status": "verified",
    "source_sha256": "cb946dda8f0c862d61a0b178a0c73dd146ce92afcbd59d87fd8ebc626bbeafbd",
    "renderer": "LibreOffice 26.2.5.1 + pypdfium2 TEST-ONLY",
    "page_count": 1,
    "pages": [
      {
        "page_number": 1,
        "path": "render/TPL-P-S-001/page_p01.png",
        "sha256": "e9de07bc1983a51d5de032ddb33a4678f27f6ad277afabc95bd9128f74874b83"
      }
    ],
    "reviewed_by": "TEST-ONLY-fixture-reviewer",
    "reviewed_at": "2026-08-25T00:00:00Z"
  },
  "unresolved_items": [],
  "metrics": {
    "paragraph_count": 16,
    "nonempty_paragraph_count": 8,
    "total_character_count": 132,
    "average_nonempty_paragraph_length": 16.5,
    "style_counts": {
      "<direct-or-default>": 4,
      "Title": 1,
      "Heading1": 3
    },
    "alignment_counts": {
      "<inherited>": 7,
      "center": 1
    },
    "bold_run_ratio": 0.5,
    "citation_marker_count": 0,
    "sentence_marker_count": 4
  },
  "structure_outline": [
    {
      "paragraph_index": 1,
      "part": "word/document.xml",
      "path": "/w:document[1]/w:body[1]/w:p[1]",
      "style_id": null,
      "alignment": null,
      "character_count": 38,
      "text_sha256": "7655ad668f732f69e298377be593bef26f6321aacb4f6d4384cfc44b2c033073",
      "run_count": 1,
      "bold_run_count": 0,
      "sentence_mark_count": 1,
      "citation_mark_count": 0,
      "role_hint": "body"
    },
    {
      "paragraph_index": 2,
      "part": "word/document.xml",
      "path": "/w:document[1]/w:body[1]/w:p[2]",
      "style_id": null,
      "alignment": null,
      "character_count": 0,
      "text_sha256": "e3b0c44298fc1c149afbf4c8996fb92427ae41e4649b934ca495991b7852b855",
      "run_count": 0,
      "bold_run_count": 0,
      "sentence_mark_count": 0,
      "citation_mark_count": 0,
      "role_hint": "blank_spacing_or_container"
    },
    {
      "paragraph_index": 3,
      "part": "word/document.xml",
      "path": "/w:document[1]/w:body[1]/w:p[3]",
      "style_id": "Title",
      "alignment": "center",
      "character_count": 5,
      "text_sha256": "06b534cff64da3801d31259b7ec702dd1124e46c987954db14f9cad437d7a9f8",
      "run_count": 1,
      "bold_run_count": 1,
      "sentence_mark_count": 0,
      "citation_mark_count": 0,
      "role_hint": "heading"
    },
    {
      "paragraph_index": 4,
      "part": "word/document.xml",
      "path": "/w:document[1]/w:body[1]/w:p[4]",
      "style_id": null,
      "alignment": null,
      "character_count": 0,
      "text_sha256": "e3b0c44298fc1c149afbf4c8996fb92427ae41e4649b934ca495991b7852b855",
      "run_count": 0,
      "bold_run_count": 0,
      "sentence_mark_count": 0,
      "citation_mark_count": 0,
      "role_hint": "blank_spacing_or_container"
    },
    {
      "paragraph_index": 5,
      "part": "word/document.xml",
      "path": "/w:document[1]/w:body[1]/w:p[5]",
      "style_id": "Heading1",
      "alignment": null,
      "character_count": 3,
      "text_sha256": "8159441337783e38fedd69d717dab8647b2fc7d9a6a40ecf918dccd591c5564e",
      "run_count": 1,
      "bold_run_count": 1,
      "sentence_mark_count": 0,
      "citation_mark_count": 0,
      "role_hint": "heading"
    },
    {
      "paragraph_index": 6,
      "part": "word/document.xml",
      "path": "/w:document[1]/w:body[1]/w:p[6]",
      "style_id": null,
      "alignment": null,
      "character_count": 0,
      "text_sha256": "e3b0c44298fc1c149afbf4c8996fb92427ae41e4649b934ca495991b7852b855",
      "run_count": 0,
      "bold_run_count": 0,
      "sentence_mark_count": 0,
      "citation_mark_count": 0,
      "role_hint": "blank_spacing_or_container"
    },
    {
      "paragraph_index": 7,
      "part": "word/document.xml",
      "path": "/w:document[1]/w:body[1]/w:p[7]",
      "style_id": null,
      "alignment": null,
      "character_count": 29,
      "text_sha256": "9cf4afecdec438415c93a1a763a6b2b166e19bfa42b000a6b148a70c3daf0f1b",
      "run_count": 1,
      "bold_run_count": 0,
      "sentence_mark_count": 1,
      "citation_mark_count": 0,
      "role_hint": "body"
    },
    {
      "paragraph_index": 8,
      "part": "word/document.xml",
      "path": "/w:document[1]/w:body[1]/w:p[8]",
      "style_id": null,
      "alignment": null,
      "character_count": 0,
      "text_sha256": "e3b0c44298fc1c149afbf4c8996fb92427ae41e4649b934ca495991b7852b855",
      "run_count": 0,
      "bold_run_count": 0,
      "sentence_mark_count": 0,
      "citation_mark_count": 0,
      "role_hint": "blank_spacing_or_container"
    },
    {
      "paragraph_index": 9,
      "part": "word/document.xml",
      "path": "/w:document[1]/w:body[1]/w:p[9]",
      "style_id": "Heading1",
      "alignment": null,
      "character_count": 4,
      "text_sha256": "59d450779a747b8db81a486090e07e9b08112e45a998e39bb90d5bc621a3f2b4",
      "run_count": 1,
      "bold_run_count": 1,
      "sentence_mark_count": 0,
      "citation_mark_count": 0,
      "role_hint": "heading"
    },
    {
      "paragraph_index": 10,
      "part": "word/document.xml",
      "path": "/w:document[1]/w:body[1]/w:p[10]",
      "style_id": null,
      "alignment": null,
      "character_count": 0,
      "text_sha256": "e3b0c44298fc1c149afbf4c8996fb92427ae41e4649b934ca495991b7852b855",
      "run_count": 0,
      "bold_run_count": 0,
      "sentence_mark_count": 0,
      "citation_mark_count": 0,
      "role_hint": "blank_spacing_or_container"
    },
    {
      "paragraph_index": 11,
      "part": "word/document.xml",
      "path": "/w:document[1]/w:body[1]/w:p[11]",
      "style_id": null,
      "alignment": null,
      "character_count": 26,
      "text_sha256": "6575e1208df42fa69c9f33a0dca3085f027873c00dddf4f7cbff09b672ddcb5a",
      "run_count": 1,
      "bold_run_count": 0,
      "sentence_mark_count": 1,
      "citation_mark_count": 0,
      "role_hint": "body"
    },
    {
      "paragraph_index": 12,
      "part": "word/document.xml",
      "path": "/w:document[1]/w:body[1]/w:p[12]",
      "style_id": null,
      "alignment": null,
      "character_count": 0,
      "text_sha256": "e3b0c44298fc1c149afbf4c8996fb92427ae41e4649b934ca495991b7852b855",
      "run_count": 0,
      "bold_run_count": 0,
      "sentence_mark_count": 0,
      "citation_mark_count": 0,
      "role_hint": "blank_spacing_or_container"
    },
    {
      "paragraph_index": 13,
      "part": "word/document.xml",
      "path": "/w:document[1]/w:body[1]/w:p[13]",
      "style_id": "Heading1",
      "alignment": null,
      "character_count": 5,
      "text_sha256": "e41760171eb0c57613a24ac4247a5781afa03f5f0d74568f048a1d0fa274d452",
      "run_count": 1,
      "bold_run_count": 1,
      "sentence_mark_count": 0,
      "citation_mark_count": 0,
      "role_hint": "heading"
    },
    {